[
  {
    "claim_id": "CLAIM-VT-005",
    "related_task": "TASK-VT-005",
    "claimed_status": "covered",
    "evidence_refs": [
      "tests/test_raw_input_loader.py::test_load_all_valid_files_returns_ok_manifest",
      "tests/test_raw_input_loader.py::test_required_files_have_content",
      "tests/test_raw_input_loader.py::test_missing_required_file_sets_has_required_errors",
      "tests/test_raw_input_loader.py::test_missing_required_file_record_has_error_code",
      "tests/test_raw_input_loader.py::test_missing_optional_file_does_not_set_has_required_errors",
      "tests/test_raw_input_loader.py::test_invalid_json_file_sets_parse_error",
      "tests/test_raw_input_loader.py::test_raw_files_not_modified",
      "tests/test_raw_input_loader.py::test_manifest_records_all_required_file_keys",
      "tests/test_raw_input_loader.py::test_manifest_includes_tool_report_files",
      "tests/test_raw_input_loader.py::test_loader_has_no_gate_decision_attribute",
      "tests/test_raw_input_loader.py::test_config_json_path_overrides_and_safe_fallback",
      "tests/test_raw_input_loader.py::test_self_governance_rules_contract"
    ],
    "code_refs": [
      "src/vibe_tracing/raw_input_loader.py"
    ],
    "test_refs": [
      "tests/test_raw_input_loader.py"
    ],
    "timestamp": "2026-05-29T09:45:00Z"
  },
  {
    "claim_id": "CLAIM-VT-030",
    "related_task": "TASK-VT-030",
    "claimed_status": "covered",
    "evidence_refs": [
      "tests/test_raw_input_loader.py::test_self_governance_rules_contract"
    ],
    "code_refs": [
      "docs/prd.md",
      "docs/architecture_constraints.json",
      "docs/task_list.json",
      "docs/task_execution_rules.md"
    ],
    "test_refs": [
      "tests/test_raw_input_loader.py"
    ],
    "timestamp": "2026-05-29T09:45:00Z"
  },
  {
    "claim_id": "CLAIM-VT-031",
    "related_task": "TASK-VT-031",
    "claimed_status": "covered",
    "evidence_refs": [
      "tests/test_raw_input_loader.py::test_config_json_path_overrides_and_safe_fallback"
    ],
    "code_refs": [
      "src/vibe_tracing/raw_input_loader.py"
    ],
    "test_refs": [
      "tests/test_raw_input_loader.py"
    ],
    "timestamp": "2026-05-29T09:45:00Z"
  },
  {
    "claim_id": "CLAIM-VT-033",
    "related_task": "TASK-VT-033",
    "claimed_status": "covered",
    "evidence_refs": [
      "tests/test_claim_evidence_analyzer.py::test_claim_lookup_multi_matching_and_fail_fast"
    ],
    "code_refs": [
      "src/vibe_tracing/traceability/claim_evidence_analyzer.py"
    ],
    "test_refs": [
      "tests/test_claim_evidence_analyzer.py"
    ],
    "timestamp": "2026-05-29T10:35:00Z"
  },
  {
    "claim_id": "CLAIM-VT-034",
    "related_task": "TASK-VT-034",
    "claimed_status": "covered",
    "evidence_refs": [
      "tests/test_dashboard_renderer.py::test_dashboard_renderer_svg_no_emojis"
    ],
    "code_refs": [
      "src/vibe_tracing/dashboard_renderer.py"
    ],
    "test_refs": [
      "tests/test_dashboard_renderer.py"
    ],
    "timestamp": "2026-05-31T09:30:00Z"
  },
  {
    "claim_id": "CLAIM-VT-035",
    "related_task": "TASK-VT-035",
    "claimed_status": "covered",
    "evidence_refs": [
      "tests/test_scaffolding.py::test_run_init_creates_scaffolding",
      "tests/test_dynamic_hints.py::test_claims_schema_validation_error_with_dynamic_hints",
      "tests/test_dynamic_hints.py::test_tasks_schema_validation_error_with_dynamic_hints",
      "tests/test_dynamic_hints.py::test_task_loader_logical_validation_error_with_dynamic_hints",
      "tests/test_dynamic_hints.py::test_claim_loader_logical_validation_error_with_dynamic_hints",
      "tests/test_dynamic_hints.py::test_silent_filtering_of_template_records"
    ],
    "code_refs": [
      "src/vibe_tracing/schema_validator.py",
      "src/vibe_tracing/task_loader.py",
      "src/vibe_tracing/claim_loader.py",
      "src/vibe_tracing/cli.py"
    ],
    "test_refs": [
      "tests/test_scaffolding.py",
      "tests/test_dynamic_hints.py"
    ],
    "timestamp": "2026-05-31T11:00:00Z"
  },
  {
    "claim_id": "CLAIM-VT-036",
    "related_task": "TASK-VT-044",
    "claimed_status": "covered",
    "evidence_refs": [
      "tests/test_unified_context.py",
      "tests/test_evidence_index_builder.py",
      "tests/test_cli_analyze.py"
    ],
    "code_refs": [
      "src/vibe_tracing/context.py",
      "src/vibe_tracing/evidence_index_builder.py",
      "src/vibe_tracing/cli.py"
    ],
    "test_refs": [
      "tests/test_unified_context.py",
      "tests/test_evidence_index_builder.py",
      "tests/test_cli_analyze.py"
    ],
    "timestamp": "2026-06-07T18:45:00Z",
    "notes": "UnifiedContext 强类型领域模型，EvidenceIndexBuilder 单次加载"
  },
  {
    "claim_id": "CLAIM-VT-037",
    "related_task": "TASK-VT-045",
    "claimed_status": "covered",
    "evidence_refs": [
      "tests/test_merge_gate_engine.py"
    ],
    "code_refs": [
      "src/vibe_tracing/merge_gate_engine.py"
    ],
    "test_refs": [
      "tests/test_merge_gate_engine.py"
    ],
    "timestamp": "2026-06-07T18:45:00Z",
    "notes": "MergeGateEngine blocked 时不再吞掉 fail 级警告"
  },
  {
    "claim_id": "CLAIM-VT-038",
    "related_task": "TASK-VT-046",
    "claimed_status": "covered",
    "evidence_refs": [
      "tests/test_finalize.py",
      "tests/test_cli_analyze.py::test_prd_drift_detection"
    ],
    "code_refs": [
      "src/vibe_tracing/cli.py"
    ],
    "test_refs": [
      "tests/test_finalize.py",
      "tests/test_cli_analyze.py"
    ],
    "timestamp": "2026-06-07T18:45:00Z",
    "notes": "finalize 存储 prd_hash，analyze 检测 PRD 漂移"
  },
  {
    "claim_id": "CLAIM-VT-039",
    "related_task": "TASK-VT-047",
    "claimed_status": "covered",
    "evidence_refs": [
      "tests/test_prd_arch_validator.py",
      "tests/test_cli_analyze.py::test_mapping_dead_link_blocks",
      "tests/test_cli_analyze.py::test_mapping_must_uncovered_blocks"
    ],
    "code_refs": [
      "src/vibe_tracing/prd_arch_validator.py",
      "src/vibe_tracing/cli.py"
    ],
    "test_refs": [
      "tests/test_prd_arch_validator.py",
      "tests/test_cli_analyze.py"
    ],
    "timestamp": "2026-06-07T18:45:00Z",
    "notes": "PRD↔Arch 映射校验提取为独立模块，analyze 时持续校验"
  },
  {
    "claim_id": "CLAIM-VT-040",
    "related_task": "TASK-VT-048",
    "claimed_status": "covered",
    "evidence_refs": [
      "tests/test_claim_evidence_analyzer.py::test_claim_test_refs_cover_ac",
      "tests/test_claim_evidence_analyzer.py::test_claim_test_refs_miss_ac_coverage"
    ],
    "code_refs": [
      "src/vibe_tracing/traceability/claim_evidence_analyzer.py"
    ],
    "test_refs": [
      "tests/test_claim_evidence_analyzer.py"
    ],
    "timestamp": "2026-06-07T18:45:00Z",
    "notes": "Claim 的 test_refs 必须覆盖关联 AC"
  },
  {
    "claim_id": "CLAIM-VT-041",
    "related_task": "TASK-VT-049",
    "claimed_status": "covered",
    "evidence_refs": [
      "tests/test_scaffolding.py",
      "tests/test_cli_analyze.py::test_gates_only_skips_analysis",
      "tests/test_ghost_code_reconciler.py::test_unstaged_claims_are_not_seen"
    ],
    "code_refs": [
      "src/vibe_tracing/cli.py",
      "src/vibe_tracing/ghost_code_reconciler.py"
    ],
    "test_refs": [
      "tests/test_scaffolding.py",
      "tests/test_cli_analyze.py",
      "tests/test_ghost_code_reconciler.py"
    ],
    "timestamp": "2026-06-07T18:45:00Z",
    "notes": "hook set -e + --gates-only + staged claims 读取"
  },
  {
    "claim_id": "CLAIM-VT-042",
    "related_task": "TASK-VT-050",
    "claimed_status": "covered",
    "evidence_refs": [
      "tests/test_tool_execution.py",
      "tests/test_task_loader.py",
      "tests/test_claim_loader.py"
    ],
    "code_refs": [
      "src/vibe_tracing/tool_evidence_adapter.py",
      "src/vibe_tracing/task_loader.py",
      "src/vibe_tracing/claim_loader.py",
      "src/vibe_tracing/cli.py"
    ],
    "test_refs": [
      "tests/test_tool_execution.py",
      "tests/test_task_loader.py",
      "tests/test_claim_loader.py"
    ],
    "timestamp": "2026-06-07T18:45:00Z",
    "notes": "删除 ToolEvidenceAdapter、移除 tests/ 兜底、hashlib 顶部导入、skip_schema"
  },
  {
    "claim_id": "CLAIM-VT-043",
    "related_task": "TASK-VT-044",
    "claimed_status": "covered",
    "evidence_refs": [
      "tests/test_reflection_prompts.py"
    ],
    "code_refs": [
      "src/vibe_tracing/reflection_prompts.py",
      "src/vibe_tracing/cli.py",
      "tests/test_reflection_prompts.py"
    ],
    "test_refs": [
      "tests/test_reflection_prompts.py"
    ],
    "timestamp": "2026-06-07T19:00:00Z",
    "notes": "vt analyze 结束时输出 8 维度元认知反思提示"
  },
  {
    "claim_id": "CLAIM-VT-044",
    "related_task": "TASK-VT-044",
    "claimed_status": "covered",
    "evidence_refs": [
      "tests/test_evidence_index_builder.py"
    ],
    "code_refs": [
      "src/vibe_tracing/evidence_index_builder.py",
      "tests/conftest.py",
      "tests/test_evidence_index_builder.py"
    ],
    "test_refs": [
      "tests/test_evidence_index_builder.py"
    ],
    "timestamp": "2026-06-07T20:00:00Z",
    "notes": "EVO-001: 删除 ctx=None fallback，纯 UnifiedContext 路径"
  },
  {
    "claim_id": "CLAIM-VT-045",
    "related_task": "TASK-VT-044",
    "claimed_status": "covered",
    "evidence_refs": [
      "tests/test_architecture_compliance_checker.py"
    ],
    "code_refs": [
      "src/vibe_tracing/architecture_compliance_checker.py",
      "tests/test_architecture_compliance_checker.py"
    ],
    "test_refs": [
      "tests/test_architecture_compliance_checker.py"
    ],
    "timestamp": "2026-06-07T20:00:00Z",
    "notes": "EVO-002: 删除 constraints_data=None fallback"
  },
  {
    "claim_id": "CLAIM-VT-046",
    "related_task": "TASK-VT-044",
    "claimed_status": "covered",
    "evidence_refs": [
      "tests/test_task_loader.py",
      "tests/test_claim_loader.py"
    ],
    "code_refs": [
      "src/vibe_tracing/task_loader.py",
      "src/vibe_tracing/claim_loader.py",
      "src/vibe_tracing/cli.py"
    ],
    "test_refs": [